{
  "v": 1,
  "type": "question.references",
  "request_id": "22222222-2222-4222-8222-222222222222",
  "runtime_id": "55555555-5555-4555-8555-555555555555",
  "runtime_epoch": "66666666-6666-4666-8666-666666666666",
  "payload": {
    "sequence": 1,
    "items": [
      {
        "question_id": "44444444-4444-4444-8444-444444444444",
        "session_id": "77777777-7777-4777-8777-777777777777",
        "kind": "question",
        "state": "pending",
        "expires_at": "2026-10-26T12:03:00.000Z"
      },
      {
        "question_id": "88888888-8888-4888-8888-888888888888",
        "session_id": "77777777-7777-4777-8777-777777777777",
        "kind": "timed_question",
        "state": "continued",
        "expires_at": null
      }
    ]
  }
}
